,name,tags,emoji
0,grinning face with open mouth,"['grinning', 'face']",??
1,smiling face with open mouth,"['smiling', 'face', 'open', 'mouth']",???
2,smiling face with open mouth and smiling eyes,"['smiling', 'face', 'open', 'mouth', 'smiling', 'eyes']",???
3,grinning face with smiling eyes,"['grinning', 'face', 'smiling', 'eyes']",???
4,smiling face with open mouth and tightly closed eyes,"['smiling', 'face', 'open', 'mouth', 'tightly', 'closed', 'eyes']",???
5,smiling face with open mouth and cold sweat on the head,"['smiling', 'face', 'open', 'mouth', 'cold', 'sweat']",???
6,rolling on the floor laughing with tears of joy,"['rolling', 'floor', 'laughing']",???
7,face with tears of joy,"['tears', 'joy']",???
8,slightly smiling face,"['slightly', 'smiling', 'face']",???
9,upside down face with slightly smiling,"['upside', 'down', 'face']",???
10,winking face,"['winking', 'face']",???
11,smiling face with smiling eyes,"['smiling', 'face', 'smiling', 'eyes']",???
12,smiling face with smiling eyes with halo,"['smiling', 'face', 'halo']",??
13,smiling face with smiling eyes and three hearts,"['smiling', 'face', 'smiling', 'eyes', 'hearts']",???
14,smiling face with heart shaped eyes,"['smiling', 'face', 'heart', 'shaped', 'eyes']",???
15,grinning face with star eyes,"['grinning', 'face', 'star', 'eyes']",???
16,face throwing a kiss with heart,"['face', 'throwing', 'kiss']",???
17,kissing face,"['kissing', 'face']",???
18,white smiling face with blushing,"['white', 'smiling', 'face']",??
19,kissing face with closed eyes blushing,"['kissing', 'face', 'closed', 'eyes']",???
20,kissing face with smiling eyes,"['kissing', 'face', 'smiling', 'eyes']",???
21,face savouring delicious food,"['face', 'savouring', 'delicious', 'food']",???
22,face with stuck out tongue,"['face', 'stuck', 'tongue']",???
23,face with stuck out tongue and winking eye,"['face', 'tongue', 'winking', 'eye']",???
24,grinning face with one large and one small eye,"['grinning', 'face', 'large', 'small', 'eye']",???
25,face with stuck out tongue and tightly closed eyes,"['face', 'tongue', 'tightly', 'closed', 'eyes']",???
26,money mouth face with dollar sign eyes,"['money', 'mouth', 'face']",?夷?
27,smiling face with smiling eyes with arms trying to hug,"['hugging', 'face']",?夷?
28,round eyes with hand covering mouth,"['smiling', 'face', 'smiling', 'eyes', 'hand', 'covering', 'mouth']",???
29,face with finger covering closed lips,"['face', 'finger', 'covering', 'closed', 'lips']",???
30,a thoughtful expression with the index and thumb forming a V shape on the chin,"['thinking', 'face']",?夷?
31,zipper mouth face with round eyes,"['zipper', 'mouth', 'face']",?夷?
32,face with one eyebrow raised with a horizontally closed mouth,"['eyebrow', 'raised']",???
33,neutral face with a horizontally closed mouth,"['neutral', 'face']",???
34,expressionless face with a horizontally closed mouth and eyes,"['expressionless', 'face']",???
35,face without mouth with round eyes,"['face', 'without mouth']",???
36,smiling face with smirking eyes and mouth,"['smirking', 'face']",???
37,unamused face with smirking eyes,"['unamused', 'face']",???
38,face with rolling up eyes,"['rolling', 'eyes']",???
39,showing a toothy grimacing face,"['grimacing', 'face']",???
40,lying face with long nose,"['lying', 'face']",???
41,relieved face with closed eyes and smiling mouth,"['relieved', 'face']",???
42,pensive face with closed eyes,"['pensive', 'face']",???
43,sleepy face with slightly opened mouth and a comical bubble from the nose,"['sleepy', 'face']",???
44,drooling face,"['drooling', 'face']",???
45,sleeping face with zzz marks above the face,"['sleeping', 'face']",???
46,face with medical mask,"['face', 'medical', 'mask']",???
47,face with thermometer on a mouth ,"['face', 'thermometer']",?夷?
48,face with head bandage,"['head', 'bandage']",?夷?
49,nauseated green face,"['nauseated', 'face']",???
50,nauseated face with open mouth vomiting,"['open', 'mouth', 'vomiting']",???
51,sneezing face with white handkerchief,"['sneezing', 'face']",???
52,overheated face with cold sweat on the head,"['overheated', 'face']",???
53,freezing face with icicles under the mouth and chin,"['freezing', 'face']",???
54,face with uneven eyes and wavy mouth,"['uneven', 'eyes', 'wavy', 'mouth']",???
55,dizzy face with x signed eyes,"['dizzy', 'face']",???
56,shocked face with exploding head,"['shocked', 'face', 'exploding', 'head']",???
57,face with cowboy hat,"['face', 'cowboy', 'hat']",?姨?
58,face with party horn and party hat,"['face', 'party', 'horn', 'party', 'hat']",???
59,smiling face with sunglasses,"['smiling', 'face', 'sunglasses']",???
60,nerd face with black and big glasses and two front teeth,"['nerd', 'face']",?夷?
61,a questioning expression face with monocle,"['face', 'monocle']",?彛?
62,confused face with round eyes ,"['confused', 'face']",???
63,worried face,"['worried', 'face']",???
64,slightly frowning face,"['slightly', 'frowning', 'face']",???
65,white frowning face,"['white', 'frowning', 'face']",??
66,face with open mouth,"['open', 'mouth']",???
67,hushed face with open mouth,"['hushed', 'face']",???
68,astonished face,"['astonished', 'face']",???
69,flushed face,"['flushed', 'face']",???
70,face with pleading eyes,"['pleading', 'eyes']",??
71,frowning face with open mouth,"['frowning', 'face', 'open', 'mouth']",???
72,anguished face with open mouth,"['anguished', 'face']",???
73,A face with a worried expression and a blue gradient,"['fearful', 'face']",???
74,face with open mouth and cold sweat with a blue gradient,"['open', 'mouth', 'cold', 'sweat']",???
75,disappointed but relieved face with cold sweat on the head,"['disappointed', 'relieved', 'face']",???
76,crying face but relieved,"['crying', 'face']",???
77,loudly crying face,"['loudly', 'crying', 'face']",???
78,face screaming in fear,"['face', 'screaming', 'fear']",???
79,confounded face with a zigzag mouth,"['confounded', 'face']",???
80,disappointed expression with little pain,"['persevering', 'face']",???
81,disappointed face,"['disappointed', 'face']",???
82,face with cold sweat,"['cold', 'sweat']",???
83,"A sad face with a weary expression, as if feeling exhausted or defeated","['weary', 'face']",???
84,"A distressed face with furrowed brows, indicating a sense of discomfort or frustration","['tired', 'face']",???
85,"A face showing frustration with steam coming from the nostrils, suggesting intense emotion or anger","['look', 'triumph']",???
86,"An angry face with furrowed brows, showing frustration or strong disapproval.","['pouting', 'face']",???
87,"An annoyed face with furrowed brows and a frown, indicating irritation or anger.","['angry', 'face']",???
88,"An angry face with a censored mouth, likely expressing strong frustration or expletives.","['serious', 'face', 'symbols', 'covering', 'mouth']",???
89,A mischievous devilish face with a playful smirk and devil horns.,"['smiling', 'face', 'horns']",???
90,"An angry devilish face with furrowed brows and devil horns, showing a more intense anger.",[],?維?
91,"A white skull emoji, similar to the first but with a more neutral tone.",['skull'],??
92,"A skull and crossbones emoji, frequently associated with pirates or danger.","['skull', 'crossbones']",??
93,"A cute poop emoji with a big smile, used to add humor to conversations.","['pile', 'poo']",?裕?
94,A playful clown face emoji with exaggerated features and a big red nose.,"['clown', 'face']",???
95,"A mischievous devil face emoji with fangs, symbolizing playful or naughty behavior.","['japanese', 'ogre']",?維?
96,"A red demon mask emoji, conveying a sense of anger or villainous nature.",['japanese'],?維?
97,"A playful ghost emoji, sticking out its tongue and giving off a friendly vibe.",['ghost'],?維?
98,"A smiling alien face emoji, suggesting something otherworldly or quirky.","['extraterrestrial', 'alien']",?維?
99,"A pixelated alien face, reminiscent of retro video games.",['monster'],?維?
100," A robot face emoji, symbolizing technology or mechanical beings.","['robot', 'face']",?夷?
101," A monkey covering its eyes with hands, expressing shyness or embarrassment.","['smiling', 'cat', 'face', 'open', 'mouth']",???
102," A monkey holding its head, possibly expressing confusion or surprise.","['grinning', 'cat', 'smiling', 'eyes']",???
103," A monkey covering its mouth, symbolizing secrecy or silence.","['cat', 'tears', 'joy']",???
104," Red lipstick kiss mark, often representing love or affection.","['smiling', 'cat', 'face', 'heart', 'shaped', 'eyes']",???
105," An envelope with a heart on it, symbolizing love letters or romantic messages.","['cat', 'wry', 'smile']",???
106," A pink heart with an arrow through it, symbolizing love or affection.","['kissing', 'cat', 'face', 'closed', 'eyes']",???
107," A gift-wrapped heart, symbolizing a present or a romantic gesture.","['weary', 'cat', 'face']",??
108," A sparkling pink heart, representing love or positive feelings.","['crying', 'cat', 'face']",???
109," A heart with dashed lines, indicating a broken heart or lost love.","['pouting', 'cat', 'face']",???
110," Two spinning hearts, symbolizing love or connection between people.","['evil', 'monkey']",???
111," Two pink hearts of different sizes, symbolizing love or affection.","['evil', 'monkey']",???
112," A purple heart, often representing compassion or calm love.","['evil', 'monkey']",???
113," A black heart, often used to express sorrow or deep emotions.",['mark'],?萸?
114," The number 100, symbolizing something perfect or complete.","['love', 'letter']",?萸?
115," Red anger symbols, often representing frustration or rage.","['heart', 'arrow']",?裕?
116," An explosion symbol, conveying shock, impact, or excitement.","['heart', 'ribbon']",?裕?
117," A shooting star, representing wishes or dreams.","['sparkling', 'heart']",?裕?
118," Blue teardrops, symbolizing sadness or crying.","['growing', 'heart']",?裕?
119," A cloud burst, representing confusion or daydreaming.","['beating', 'heart']",?裕?
120," A series of Zs, symbolizing sleep or tiredness.","['revolving', 'hearts']",?裕?
121," A waving hand emoji, symbolizing a greeting or goodbye.",['hearts'],?裕?
122," A hand waving, expressing a friendly greeting.","['heart', 'decoration']",?裕?
123," A hand waving, symbolizing a casual hello or goodbye.","['heavy', 'heart', 'exclamation', 'mark', 'ornament']",??
124," A hand waving, a gesture of parting or greeting.","['broken', 'heart']",?裕?
125," A white speech bubble, often used to signify speech or conversation.","['heavy', 'black', 'heart']",??
126," A speech bubble with an eye, showing surprise or attention.",['heart'],???
127," A speech bubble, typically used to represent communication or conversation.","['yellow', 'heart']",?裕?
128," A star-shaped burst, indicating excitement or surprise.","['green', 'heart']",?裕?
129," A cloud thought bubble, symbolizing thinking or pondering.","['blue', 'heart']",?裕?
130," A 'Zzz' symbol, representing sleep or tiredness.","['purple', 'heart']",?裕?
131," A waving hand emoji, symbolizing saying hello or goodbye.","['black', 'heart']",?堉?
132," A waving hand, used to greet someone or say farewell.","['hundred', 'points', 'symbol']",?裕?
133," A waving hand emoji, expressing friendliness.","['anger', 'symbol']",?裕?
134," A waving hand emoji, symbolizing a casual greeting.","['collision', 'symbol']",?裕?
135," A purple heart, representing compassion or calm love.","['dizzy', 'symbol']",?裕?
136," A black heart, often used to express sorrow or deep emotions.","['splashing', 'sweat', 'symbol']",?裕?
137," A red heart with an exclamation point, indicating strong love or affection.","['dash', 'symbol']",?裕?
138," A broken red heart, symbolizing heartache or sorrow.",['hole'],?鍮?
139," A red heart, symbolizing love and passion.",['bomb'],?裕?
140," An orange heart, expressing warmth or friendship.",['balloon'],?裕?
141," A yellow heart, symbolizing happiness and friendship.","['eye', 'speech', 'bubble']",?紐볠닼琉는?낆쐫?⑦닔
142," A green heart, representing a sense of nature or balance.","['speech', 'bubble']",?肉?
143," A blue heart, often used to convey peace or calm.","['right', 'anger', 'bubble']",?肉?
144," A purple heart, symbolizing compassion or deep emotional connection.","['thought', 'balloon']",?裕?
145," A black heart, symbolizing dark or deep emotions.","['sleeping', 'symbol']",?裕?
146," A white heart, symbolizing purity or clarity.","['waving', 'hand', 'sign']",?紐?
147," A gray heart, symbolizing neutrality or sadness.","['waving', 'hand', 'sign']",?紐?琉?
148," A yellow heart, expressing joy or warmth.","['waving', 'hand', 'sign']",?紐?琉?
149," A green heart, symbolizing love for nature or friendship.","['waving', 'hand', 'sign']",?紐?琉?
150,waving hand sign,"['waving', 'hand', 'sign']",?紐?琉?
151,waving hand sign,"['waving', 'hand', 'sign']",?紐?琉?
152,raised back of hand,"['raised', 'back', 'hand']",?姨
153,raised back of hand,"['raised', 'back', 'hand']",?姨?琉?
154,raised back of hand,"['raised', 'back', 'hand']",?姨?琉?
155,raised back of hand,"['raised', 'back', 'hand']",?姨?琉?
156,raised back of hand,"['raised', 'back', 'hand']",?姨?琉?
157,raised back of hand,"['raised', 'back', 'hand']",?姨?琉?
158,raised hand with fingers splayed,"['raised', 'hand', 'fingers', 'splayed']",?堉?
159,raised hand with fingers splayed,"['raised', 'hand', 'fingers', 'splayed']",?堉?琉?
160,raised hand with fingers splayed,"['raised', 'hand', 'fingers', 'splayed']",?堉?琉?
161,raised hand with fingers splayed,"['raised', 'hand', 'fingers', 'splayed']",?堉?琉?
162,raised hand with fingers splayed,"['raised', 'hand', 'fingers', 'splayed']",?堉?琉?
163,raised hand with fingers splayed,"['raised', 'hand', 'fingers', 'splayed']",?堉?琉?
164,raised hand,"['raised', 'hand']",??
165,raised hand,"['raised', 'hand']",??깆쐠?
166,raised hand,"['raised', 'hand']",??깆쐠?
167,raised hand,"['raised', 'hand']",??깆쐠?
168,raised hand,"['raised', 'hand']",??깆쐠?
169,raised hand,"['raised', 'hand']",??깆쐠?
170,raised hand with part between middle and ring fingers,"['raised', 'hand', 'part', 'middle', 'ring', 'fingers']",?堉?
171,raised hand with part between middle and ring fingers,"['raised', 'hand', 'part', 'middle', 'ring', 'fingers']",?堉?琉?
172,raised hand with part between middle and ring fingers,"['raised', 'hand', 'part', 'middle', 'ring', 'fingers']",?堉?琉?
173,raised hand with part between middle and ring fingers,"['raised', 'hand', 'part', 'middle', 'ring', 'fingers']",?堉?琉?
174,raised hand with part between middle and ring fingers,"['raised', 'hand', 'part', 'middle', 'ring', 'fingers']",?堉?琉?
175,raised hand with part between middle and ring fingers,"['raised', 'hand', 'part', 'middle', 'ring', 'fingers']",?堉?琉?
176,ok hand sign,"['ok', 'hand', 'sign']",?紐?
177,ok hand sign,"['ok', 'hand', 'sign']",?紐?琉?
178,ok hand sign,"['ok', 'hand', 'sign']",?紐?琉?
179,ok hand sign,"['ok', 'hand', 'sign']",?紐?琉?
180,ok hand sign,"['ok', 'hand', 'sign']",?紐?琉?
181,ok hand sign,"['ok', 'hand', 'sign']",?紐?琉?
182,victory hand,"['victory', 'hand']",??
183,victory hand,"['victory', 'hand']",??댁쐠?
184,victory hand,"['victory', 'hand']",??댁쐠?
185,victory hand,"['victory', 'hand']",??댁쐠?
186,victory hand,"['victory', 'hand']",??댁쐠?
187,victory hand,"['victory', 'hand']",??댁쐠?
188,hand with index and middle fingers crossed,"['hand', 'index', 'middle', 'fingers', 'crossed']",?姨?
189,hand with index and middle fingers crossed,"['hand', 'index', 'middle', 'fingers', 'crossed']",?姨?琉?
190,hand with index and middle fingers crossed,"['hand', 'index', 'middle', 'fingers', 'crossed']",?姨?琉?
191,hand with index and middle fingers crossed,"['hand', 'index', 'middle', 'fingers', 'crossed']",?姨?琉?
192,hand with index and middle fingers crossed,"['hand', 'index', 'middle', 'fingers', 'crossed']",?姨?琉?
193,hand with index and middle fingers crossed,"['hand', 'index', 'middle', 'fingers', 'crossed']",?姨?琉?
194,i love you hand sign,"['hand', 'sign']",?姨?
195,i love you hand sign,"['hand', 'sign']",?姨?琉?
196,i love you hand sign,"['hand', 'sign']",?姨?琉?
197,i love you hand sign,"['hand', 'sign']",?姨?琉?
198,i love you hand sign,"['hand', 'sign']",?姨?琉?
199,i love you hand sign,"['hand', 'sign']",?姨?琉?
200,sign of the horns,"['sign', 'horns']",?夷?
201,sign of the horns,"['sign', 'horns']",?夷?琉?
202,sign of the horns,"['sign', 'horns']",?夷?琉?
203,sign of the horns,"['sign', 'horns']",?夷?琉?
204,sign of the horns,"['sign', 'horns']",?夷?琉?
205,sign of the horns,"['sign', 'horns']",?夷?琉?
206,call me hand,['hand'],?夷?
207,call me hand,['hand'],?夷?琉?
208,call me hand,['hand'],?夷?琉?
209,call me hand,['hand'],?夷?琉?
210,call me hand,['hand'],?夷?琉?
211,call me hand,['hand'],?夷?琉?
212,white left pointing backhand index,"['pointing', 'index']",?紐?
213,white left pointing backhand index,"['pointing', 'index']",?紐?琉?
214,white left pointing backhand index,"['pointing', 'index']",?紐?琉?
215,white left pointing backhand index,"['pointing', 'index']",?紐?琉?
216,white left pointing backhand index,"['pointing', 'index']",?紐?琉?
217,white left pointing backhand index,"['pointing', 'index']",?紐?琉?
218,white right pointing backhand index,"['white', 'right', 'pointing', 'index']",?紐?
219,white right pointing backhand index,"['white', 'right', 'pointing', 'index']",?紐?琉?
220,white right pointing backhand index,"['white', 'right', 'pointing', 'index']",?紐?琉?
221,white right pointing backhand index,"['white', 'right', 'pointing', 'index']",?紐?琉?
222,white right pointing backhand index,"['white', 'right', 'pointing', 'index']",?紐?琉?
223,white right pointing backhand index,"['white', 'right', 'pointing', 'index']",?紐?琉?
224,white up pointing backhand index,"['white', 'pointing', 'index']",?紐?
225,white up pointing backhand index,"['white', 'pointing', 'index']",?紐?琉?
226,white up pointing backhand index,"['white', 'pointing', 'index']",?紐?琉?
227,white up pointing backhand index,"['white', 'pointing', 'index']",?紐?琉?
228,white up pointing backhand index,"['white', 'pointing', 'index']",?紐?琉?
229,white up pointing backhand index,"['white', 'pointing', 'index']",?紐?琉?
230,reversed hand with middle finger extended,"['reversed', 'hand', 'middle', 'finger', 'extended']",?堉?
231,reversed hand with middle finger extended,"['reversed', 'hand', 'middle', 'finger', 'extended']",?堉?琉?
232,reversed hand with middle finger extended,"['reversed', 'hand', 'middle', 'finger', 'extended']",?堉?琉?
233,reversed hand with middle finger extended,"['reversed', 'hand', 'middle', 'finger', 'extended']",?堉?琉?
234,reversed hand with middle finger extended,"['reversed', 'hand', 'middle', 'finger', 'extended']",?堉?琉?
235,reversed hand with middle finger extended,"['reversed', 'hand', 'middle', 'finger', 'extended']",?堉?琉?
236,white down pointing backhand index,"['white', 'pointing', 'index']",?紐?
237,white down pointing backhand index,"['white', 'pointing', 'index']",?紐?琉?
238,white down pointing backhand index,"['white', 'pointing', 'index']",?紐?琉?
239,white down pointing backhand index,"['white', 'pointing', 'index']",?紐?琉?
240,white down pointing backhand index,"['white', 'pointing', 'index']",?紐?琉?
241,white down pointing backhand index,"['white', 'pointing', 'index']",?紐?琉?
242,white up pointing index,"['white', 'pointing', 'index']",??
243,white up pointing index,"['white', 'pointing', 'index']",??우쐠?
244,white up pointing index,"['white', 'pointing', 'index']",??우쐠?
245,white up pointing index,"['white', 'pointing', 'index']",??우쐠?
246,white up pointing index,"['white', 'pointing', 'index']",??우쐠?
247,white up pointing index,"['white', 'pointing', 'index']",??우쐠?
248,thumbs up sign,['sign'],?紐?
249,thumbs up sign,['sign'],?紐?琉?
250,thumbs up sign,['sign'],?紐?琉?
251,thumbs up sign,['sign'],?紐?琉?
252,thumbs up sign,['sign'],?紐?琉?
253,thumbs up sign,['sign'],?紐?琉?
254,thumbs down sign,['sign'],?紐?
255,thumbs down sign,['sign'],?紐?琉?
256,thumbs down sign,['sign'],?紐?琉?
257,thumbs down sign,['sign'],?紐?琉?
258,thumbs down sign,['sign'],?紐?琉?
259,thumbs down sign,['sign'],?紐?琉?
260,raised fist,"['raised', 'fist']",??
261,raised fist,"['raised', 'fist']",??딆쐠?
262,raised fist,"['raised', 'fist']",??딆쐠?
263,raised fist,"['raised', 'fist']",??딆쐠?
264,raised fist,"['raised', 'fist']",??딆쐠?
265,raised fist,"['raised', 'fist']",??딆쐠?
266,fisted hand sign,"['fisted', 'hand', 'sign']",?紐?
267,fisted hand sign,"['fisted', 'hand', 'sign']",?紐?琉?
268,fisted hand sign,"['fisted', 'hand', 'sign']",?紐?琉?
269,fisted hand sign,"['fisted', 'hand', 'sign']",?紐?琉?
270,fisted hand sign,"['fisted', 'hand', 'sign']",?紐?琉?
271,fisted hand sign,"['fisted', 'hand', 'sign']",?紐?琉?
272,left facing fist,"['facing', 'fist']",?姨?
273,left facing fist,"['facing', 'fist']",?姨?琉?
274,left facing fist,"['facing', 'fist']",?姨?琉?
275,left facing fist,"['facing', 'fist']",?姨?琉?
276,left facing fist,"['facing', 'fist']",?姨?琉?
277,left facing fist,"['facing', 'fist']",?姨?琉?
278,right facing fist,"['right', 'facing', 'fist']",?姨?
279,right facing fist,"['right', 'facing', 'fist']",?姨?琉?
280,right facing fist,"['right', 'facing', 'fist']",?姨?琉?
281,right facing fist,"['right', 'facing', 'fist']",?姨?琉?
282,right facing fist,"['right', 'facing', 'fist']",?姨?琉?
283,right facing fist,"['right', 'facing', 'fist']",?姨?琉?
284,clapping hands sign,"['clapping', 'hands', 'sign']",?紐?
285,clapping hands sign,"['clapping', 'hands', 'sign']",?紐?琉?
286,clapping hands sign,"['clapping', 'hands', 'sign']",?紐?琉?
287,clapping hands sign,"['clapping', 'hands', 'sign']",?紐?琉?
288,clapping hands sign,"['clapping', 'hands', 'sign']",?紐?琉?
289,clapping hands sign,"['clapping', 'hands', 'sign']",?紐?琉?
290,person raising both hands in celebration,"['person', 'raising', 'hands', 'celebration']",???
291,person raising both hands in celebration,"['person', 'raising', 'hands', 'celebration']",???琉?
292,person raising both hands in celebration,"['person', 'raising', 'hands', 'celebration']",???琉?
293,person raising both hands in celebration,"['person', 'raising', 'hands', 'celebration']",???琉?
294,person raising both hands in celebration,"['person', 'raising', 'hands', 'celebration']",???琉?
295,person raising both hands in celebration,"['person', 'raising', 'hands', 'celebration']",???琉?
296,open hands sign,"['open', 'hands', 'sign']",?紐?
297,open hands sign,"['open', 'hands', 'sign']",?紐?琉?
298,open hands sign,"['open', 'hands', 'sign']",?紐?琉?
299,open hands sign,"['open', 'hands', 'sign']",?紐?琉?
300,open hands sign,"['open', 'hands', 'sign']",?紐?琉?
301,open hands sign,"['open', 'hands', 'sign']",?紐?琉?
302,palms up together,"['palms', 'up', 'together']",???
303,palms up together,"['palms', 'up', 'together']",???琉?
304,palms up together,"['palms', 'up', 'together']",???琉?
305,palms up together,"['palms', 'up', 'together']",???琉?
306,palms up together,"['palms', 'up', 'together']",???琉?
307,palms up together,"['palms', 'up', 'together']",???琉?
308,handshake,[],?姨?
309,person with folded hands,"['person', 'folded', 'hands']",???
310,person with folded hands,"['person', 'folded', 'hands']",???琉?
311,person with folded hands,"['person', 'folded', 'hands']",???琉?
312,person with folded hands,"['person', 'folded', 'hands']",???琉?
313,person with folded hands,"['person', 'folded', 'hands']",???琉?
314,person with folded hands,"['person', 'folded', 'hands']",???琉?
315,writing hand,"['writing', 'hand']",??
316,writing hand,"['writing', 'hand']",??낆쐠?
317,writing hand,"['writing', 'hand']",??낆쐠?
318,writing hand,"['writing', 'hand']",??낆쐠?
319,writing hand,"['writing', 'hand']",??낆쐠?
320,writing hand,"['writing', 'hand']",??낆쐠?
321,nail polish,"['nail', 'polish']",?萸?
322,nail polish,"['nail', 'polish']",?萸?琉?
323,nail polish,"['nail', 'polish']",?萸?琉?
324,nail polish,"['nail', 'polish']",?萸?琉?
325,nail polish,"['nail', 'polish']",?萸?琉?
326,nail polish,"['nail', 'polish']",?萸?琉?
327,selfie,['selfie'],???
328,selfie,['selfie'],???琉?
329,selfie,['selfie'],???琉?
330,selfie,['selfie'],???琉?
331,selfie,['selfie'],???琉?
332,selfie,['selfie'],???琉?
333,flexed biceps,"['flexed', 'biceps']",?裕?
334,flexed biceps,"['flexed', 'biceps']",?裕?琉?
335,flexed biceps,"['flexed', 'biceps']",?裕?琉?
336,flexed biceps,"['flexed', 'biceps']",?裕?琉?
337,flexed biceps,"['flexed', 'biceps']",?裕?琉?
338,flexed biceps,"['flexed', 'biceps']",?裕?琉?
339,leg,[],???
340,leg,[],???琉?
341,leg,[],???琉?
342,leg,[],???琉?
343,leg,[],???琉?
344,leg,[],???琉?
345,foot,['foot'],???
346,foot,['foot'],???琉?
347,foot,['foot'],???琉?
348,foot,['foot'],???琉?
349,foot,['foot'],???琉?
350,foot,['foot'],???琉?
351,ear,[],?紐?
352,ear,[],?紐?琉?
353,ear,[],?紐?琉?
354,ear,[],?紐?琉?
355,ear,[],?紐?琉?
356,ear,[],?紐?琉?
357,nose,['nose'],?紐?
358,nose,['nose'],?紐?琉?
359,nose,['nose'],?紐?琉?
360,nose,['nose'],?紐?琉?
361,nose,['nose'],?紐?琉?
362,nose,['nose'],?紐?琉?
363,brain,['brain'],?彛?
364,tooth,[],???
365,bone,['bone'],???
366,eyes,['eyes'],??
367,eye,['eye'],?紐?
368,tongue,['tongue'],?紐?
369,mouth,['mouth'],?紐?
370,baby,['baby'],?維?
371,baby,['baby'],?維?琉?
372,baby,['baby'],?維?琉?
373,baby,['baby'],?維?琉?
374,baby,['baby'],?維?琉?
375,baby,['baby'],?維?琉?
376,child,['child'],?彛?
377,child,['child'],?彛?琉?
378,child,['child'],?彛?琉?
379,child,['child'],?彛?琉?
380,child,['child'],?彛?琉?
381,child,['child'],?彛?琉?
